{"content_version":"1.0.0","dataset_id":"ecosis_freeze_dried_leaf_spectra_and_measured_traits_from_the_reflectance_nirs","evidence_ref":"ecosis-evidence.json","evidence_sha256":"f541c62dbb7d4fbc7e30e145c087eb97e2039b6a82d4d3d29f8ba399060462c4","integration_protocol":"domains.datasets_sidecar.v0.1","purposes":["structure_sensitive_challenge"],"qualification_protocol":"domains.bank.v0.1","schema_version":1,"task_id":"f1a30d3086e6aca919b68c2f53b50ae8fb684451d46959e96c15b52e583285f9"}
