{"content_version":"1.0.0","dataset_id":"perten_cereals_nir","evidence_ref":"perten-evidence.json","evidence_sha256":"faea59056157e1022571eb5c011ca30ebbc96a5bc1bd62fb3b1318e718cf73ea","integration_protocol":"domains.datasets_sidecar.v0.1","purposes":["structure_sensitive_challenge"],"qualification_protocol":"domains.bank.v0.1","schema_version":1,"task_id":"0991a012c4244761e04beae32405424fe152b835bd653aeddd67571844b96ec6"}
